DATE: 14-02-2024

PROG 3:

CREATE TABLE EMPLOYEE 
-------------------------------
SQL> CREATE TABLE EMPLOYEE(
  2  EID INT PRIMARY KEY,
  3  NAME VARCHAR2(20),
  4  ADDRESS VARCHAR2(20),
  5  GENDER CHAR(1) CHECK( GENDER='M' OR GENDER='F'),
  6  SALARY NUMBER(6),
  7  SUPEREID REFERENCES EMPLOYEE(EID),
  8  DNO NUMBER);

Table created.
INSERT INTO EMPLOYEE VALUES( 1, 'RAHUL', ' MANGALURU' , 'M', 35000,1,NULL);
INSERT INTO EMPLOYEE VALUES( 2, 'SAHANA', ' MANGALURU' , 'F', 35000,1,NULL);
INSERT INTO EMPLOYEE VALUES( 3, 'SAGAR', ' BENGALURU' , 'M', 35000,1,NULL);
INSERT INTO EMPLOYEE VALUES( 4, 'SAGARIK', ' MANGALURU' , 'M', 35000,1,NULL);
INSERT INTO EMPLOYEE VALUES( 5, 'SAJAAN', ' MYSORE' , 'M', 600000,1,NULL);


SQL> SELECT *FROM EMPLOYEE;

       EID NAME                 ADDRESS              G     SALARY   SUPEREID        DNO
---------- -------------------- -------------------- - ---------- ---------- ----------
         1 RAHUL                 MANGALURU           M      35000          1
         2 SAHANA                MANGALURU           F      35000          1
         3 SAGAR                 BENGALURU           M      35000          1
         4 SAGARIK               MANGALURU           M      35000          1
         5 SAJAAN                MYSORE              M     600000          1


---------------------------------------------------------------------------------------------------

CREATE TABLE DEPARTMENT
-----------------------------

SQL> CREATE TABLE DEPARTMENT(
  2  DNUM NUMBER(5) PRIMARY KEY,
  3  DNAME VARCHAR2(10),
  4  DMGR_ID REFERENCES EMPLOYEE(EID),
  5  MGR_START_DATE DATE);

Table created.

INSERT INTO DEPARTMENT VALUES(1,'CSE',1,'2-NOV-2007');
INSERT INTO DEPARTMENT VALUES(2,'IOT',2,'2-NOV-2007');
INSERT INTO DEPARTMENT VALUES(3,'Account',2,'2-NOV-2017');
INSERT INTO DEPARTMENT VALUES(4,'ISE',1,'2-NOV-2000');
INSERT INTO DEPARTMENT VALUES(5,'Finance',1,'3-NOV-2001');


SQL> SELECT * FROM DEPARTMENT;

      DNUM DNAME         DMGR_ID MGR_START
---------- ---------- ---------- ---------
         1 CSE                 1 02-NOV-07
         2 IOT                 2 02-NOV-07
         3 Account             2 02-NOV-17
         4 ISE                 1 02-NOV-00
         5 Finance             1 03-NOV-01

-----------------------------------------------------------------------------------------------
SQL> ALTER TABLE EMPLOYEE ADD CONSTRAINT fk FOREIGN KEY(DNO) REFERENCES DEPARTMENT(DNUM);

Table altered.

SQL> UPDATE EMPLOYEE
  2  SET DNO=4
  3  WHERE EID=1;

1 row updated.

SQL> UPDATE EMPLOYEE
  2  SET DNO=1
  3  WHERE EID=2;

1 row updated.

SQL> UPDATE EMPLOYEE
  2  SET DNO=3
  3  WHERE EID=3;

1 row updated.

SQL> UPDATE EMPLOYEE
  2  SET DNO=3
  3  WHERE EID=4;

1 row updated.

SQL> UPDATE EMPLOYEE
  2  SET DNO=3
  3  WHERE EID=5;

1 row updated.

SQL> SELECT * FROM EMPLOYEE;

       EID NAME                 ADDRESS              G     SALARY   SUPEREID        DNO
---------- -------------------- -------------------- - ---------- ---------- ----------
         1 RAHUL                 MANGALURU           M      35000          1          4
         2 SAHANA                MANGALURU           F      35000          1          1
         3 SAGAR                 BENGALURU           M      35000          1          3
         4 SAGARIK               MANGALURU           M      35000          1          3
         5 SAJAAN                MYSORE              M     600000          1          3

------------------------------------------------------------------------------------------------------

SQL> CREATE TABLE DLOCATION(
  2  DNO REFERENCES DEPARTMENT(DNUM),
  3  LOCATION VARCHAR2(10),
  4  PRIMARY KEY(DNO,LOCATION));

Table created.

INSERT INTO DLOCATION VALUES(1,'MANGALURU');
INSERT INTO DLOCATION VALUES(1,'MYSORE');
INSERT INTO DLOCATION VALUES(2,'MANGALURU');
INSERT INTO DLOCATION VALUES(3,'BENGALURU');
INSERT INTO DLOCATION VALUES(4,'MANGALURU');
INSERT INTO DLOCATION VALUES(5,'MANGALURU');


SQL> SELECT * FROM DLOCATION;

       DNO LOCATION
---------- ----------
         1 MANGALURU
         1 MYSORE
         2 MANGALURU
         3 BENGALURU
         4 MANGALURU
         5 MANGALURU

6 rows selected.

----------------------------------------------------------------------------------------------

SQL> CREATE TABLE PROJECT(
  2  PNUM NUMBER(2) PRIMARY KEY,
  3  PNAME VARCHAR2(20),
  4  PLOCATION VARCHAR2(10),
  5  DNO NUMBER REFERENCES DEPARTMENT(DNUM)
  6  );

Table created.

INSERT INTO PROJECT VALUES(1,'IOT','MANGALURU',1);
INSERT INTO PROJECT VALUES(2,'Data Mining','MANGALURU',1);
INSERT INTO PROJECT VALUES(3,'CC','HUBLI',3);
INSERT INTO PROJECT VALUES(4,'Image Processing','MANGALURU',4);
INSERT INTO PROJECT VALUES(5,'Research','MANGALURU',5);


SQL> SELECT * FROM PROJECT;

      PNUM PNAME                PLOCATION         DNO
---------- -------------------- ---------- ----------
         1 IOT                  MANGALURU           1
         2 Data Mining          MANGALURU           1
         3 CC                   HUBLI               3
         4 Image Processing     MANGALURU           4
         5 Research             MANGALURU           5

------------------------------------------------------------------------------------------------------------------
SQL> CREATE TABLE WORKS_ON(
  2  EID NUMBER(5) REFERENCES EMPLOYEE(EID),
  3  PNO NUMBER(2) REFERENCES PROJECT(PNUM),
  4  HOURS NUMBER(5,2),
  5  PRIMARY KEY(EID,PNO));

Table created.

INSERT INTO WORKS_ON VALUES(1,1,4);
INSERT INTO WORKS_ON VALUES(2,1,5);
INSERT INTO WORKS_ON VALUES(3,2,4);
INSERT INTO WORKS_ON VALUES(4,3,4);
INSERT INTO WORKS_ON VALUES(5,5,4);



SQL> SELECT * FROM WORKS_ON;

       EID        PNO      HOURS
---------- ---------- ----------
         1          1          4
         2          1          5
         3          2          4
         4          3          4
         5          5          4

---------------------------------------------------

CREATE TABLE DEPENDENT(
EMP_ID INT CONSTRAINT DEP_EMPID_PK PRIMARY KEY,
DEPENDENT_NAME VARCHAR2(12),
GENDER VARCHAR2(5),
BDATE DATE,
RELATIONSHIP VARCHAR2(12), 
FOREIGN KEY(EMP_ID)REFERENCES EMPLOYEE(EID) ON DELETE CASCADE);

Table created.

INSERT INTO DEPENDENT VALUES(1,'SHREYA','F','22-JAN-75','WIFE');
INSERT INTO DEPENDENT VALUES(2,'AKASH','M','15-JUN-77','BROTHER');
INSERT INTO DEPENDENT VALUES(3,'PRIYA','F','10-SEP-80','SISTER');
INSERT INTO DEPENDENT VALUES(4,'NIKHIL','M','02-FEB-79','FATHER');
INSERT INTO DEPENDENT VALUES(5,'AKSHA','F','30-OCT-75','MOTHER');

SQL> SELECT * FROM DEPENDENT;

    EMP_ID DEPENDENT_NA GENDE BDATE     RELATIONSHIP
---------- ------------ ----- --------- ------------
         1 SHREYA       F     22-JAN-75 WIFE
         2 AKASH        M     15-JUN-77 BROTHER
         3 PRIYA        F     10-SEP-80 SISTER
         4 NIKHIL       M     02-FEB-79 FATHER
         5 AKSHA        F     30-OCT-75 MOTHER

-------------------------------------------------------------------------
21-02-24

QUERY 1:

SQL> SELECT PNO
  2  FROM WORKS_ON 
  3  WHERE EID IN
  4  ( SELECT EID FROM EMPLOYEE WHERE NAME='RAHUL')
  5  UNION
  6  SELECT PNUM 
  7  FROM PROJECT 
  8  WHERE DNO IN
  9  (SELECT DNUM FROM DEPARTMENT WHERE DMGR_ID IN 
 10  (SELECT EID FROM EMPLOYEE WHERE NAME='RAHUL'));

OUTPUT:
       PNO
----------
         1
         2
         4
-----------------------------------------------------
QUERY 2:
SQL> SELECT EID, NAME, SALARY,SALARY+0.1*SALARY AS UPDATED_SALARY
  2  FROM EMPLOYEE
  3  WHERE EID IN
  4  (SELECT EID FROM WORKS_ON WHERE PNO IN(
  5  SELECT PNUM FROM PROJECT WHERE PNAME='IOT'));

OUTPUT:

       EID NAME                     SALARY UPDATED_SALARY
---------- -------------------- ---------- --------------
         1 RAHUL                     35000          38500
         2 SAHANA                    35000          38500
---------------------------------------------------------------
QUERY 3:

SQL> SELECT SUM(SALARY),AVG(SALARY),MAX(SALARY),MIN(SALARY)
  2  FROM EMPLOYEE E, DEPARTMENT D
  3  WHERE D.DNUM=E.DNO AND DNAME='Account';

OUTPUT

SUM(SALARY) AVG(SALARY) MAX(SALARY) MIN(SALARY)
----------- ----------- ----------- -----------
     670000  223333.333      600000       35000 
---------------------------------------------------------------
QUERY 4:
SQL> SELECT EID ,NAME
  2  FROM EMPLOYEE E
  3  WHERE NOT EXISTS(
  4  (SELECT PNUM FROM PROJECT WHERE DNO=5) MINUS
  5  (SELECT PNO FROM WORKS_ON W WHERE W.EID=E.EID)
  6  );

OUTPUT:

       EID NAME
---------- --------------------
         5 SAJAAN       
-------------------------------------------------------
QUERY 5:
SQL> CREATE VIEW DEPINFO(NAME,COUNT_EMP,SUM_SAL) AS
  2  SELECT D.DNAME, COUNT(*),SUM(SALARY)
  3  FROM DEPARTMENT D INNER JOIN EMPLOYEE E
  4  ON E.DNO=D.DNUM
  5  GROUP BY D.DNAME;

View created.

SQL> SELECT * FROM DEPINFO;

NAME        COUNT_EMP    SUM_SAL
---------- ---------- ----------
ISE                 1      35000
Account             3     670000
CSE                 1      35000
-------------------------------------------------------
